{"apiVersion":"v1","generatedAt":"2026-10-26T23:32:59Z","methodology":{"version":"1.0","name":"Population decline risk","scale":"0 (no sign of decline) to 100 (fastest, most locked-in decline)","minPopulation":100000,"components":[{"id":"fertility","label":"Fertility below replacement","weight":35,"input":"tfr (latest of World Bank / UN WPP)","zeroAt":2.1,"fullAt":0.8,"unit":"births per woman","explain":"How far the fertility rate is below the 2.1 births per woman that keeps each generation the same size."},{"id":"naturalChange","label":"More deaths than births","weight":15,"input":"naturalChangeRate (births minus deaths per 1,000 people, latest of World Bank / UN WPP)","zeroAt":5,"fullAt":-7,"unit":"per 1,000 people","explain":"Births minus deaths per 1,000 people. Full risk at 7 more deaths than births per 1,000 people a year."},{"id":"aging","label":"Aging population","weight":10,"input":"average of share65 (ramp 7% -> 30%) and medianAge (ramp 25 -> 50 years)","zeroAt":null,"fullAt":null,"unit":"mixed","parts":[{"input":"share65","zeroAt":7,"fullAt":30,"weight":1,"unit":"% of population aged 65+"},{"input":"medianAge","zeroAt":25,"fullAt":50,"weight":1,"unit":"years"}],"explain":"An older population has fewer people of child-bearing age and more deaths ahead."},{"id":"projectedDecline","label":"UN-projected population decline","weight":30,"input":"weighted average of change2050Pct (weight 1, ramp 0% -> -25%) and change2100Pct (weight 2, ramp 0% -> -60%), UN WPP medium variant vs the latest estimate year","zeroAt":null,"fullAt":null,"unit":"% change","parts":[{"input":"change2050Pct","zeroAt":0,"fullAt":-25,"weight":1,"unit":"% change by 2050"},{"input":"change2100Pct","zeroAt":0,"fullAt":-60,"weight":2,"unit":"% change by 2100"}],"explain":"The UN's central (medium) projection of how much the population shrinks by 2050 and by 2100. 2100 counts double: it captures where today's fertility leads once the current age structure has worked through."},{"id":"migration","label":"Migration does not fill the gap","weight":10,"input":"components.migrationOffsetPct (UN WPP, latest estimate year)","zeroAt":100,"fullAt":0,"unit":"% of natural decline offset by net migration","explain":"When deaths exceed births: the share of that gap NOT covered by net immigration (net emigration counts as full risk). When births exceed deaths but net emigration still shrinks the population: population change per 1,000, ramp 0 -> -10."}],"tiers":[{"name":"Critical","min":70,"description":"Shrinking fast and locked in: very low fertility, more deaths than births, steep projected decline."},{"name":"High","min":55,"description":"Decline is underway or close, with fertility far below replacement."},{"name":"Elevated","min":40,"description":"Fertility well below replacement; decline likely within decades unless migration fills the gap."},{"name":"Moderate","min":20,"description":"Some warning signs (below-replacement fertility or aging), but population still growing or stable."},{"name":"Low","min":0,"description":"Fertility near or above replacement; population projected to keep growing."}],"formula":"score = round(sum over components of weight x value), where each value is a linear ramp from 0 (at zeroAt) to 1 (at fullAt), clamped to 0..1. Weights sum to 100. Tier thresholds apply to the rounded score.","eligibility":"Ranked: countries and territories with population >= 100000 and every input available. WLD is never ranked.","docs":"https://github.com/RostyslavDzhohola/fertility-tracker/blob/main/docs/METHODOLOGY.md"},"ranking":[{"rank":1,"iso3":"HKG","name":"Hong Kong","region":"East Asia & Pacific","score":88,"tier":"Critical","components":{"fertility":{"value":0.968,"points":33.9,"weight":35},"naturalChange":{"value":0.592,"points":8.9,"weight":15},"aging":{"value":0.787,"points":7.9,"weight":10},"projectedDecline":{"value":0.909,"points":27.3,"weight":30},"migration":{"value":1,"points":10,"weight":10}},"inputs":{"tfr":0.841,"naturalChangeRate":-2.1,"share65":23.7,"medianAge":46.2,"change2050Pct":-18.2,"change2100Pct":-72,"naturalChange":-15896,"netMigration":-3427,"populationChangePerThousand":-2.6,"migrationOffsetPct":-22},"factors":["Fertility 0.84 births per woman (2024), about two-fifths of the 2.1 replacement level","UN projects a 72% fall by 2100 (7.4 million in 2023 → 2.1 million); peaked in 2020","More people leave than arrive (net outflow 3,430 in 2023), deepening the decline","More deaths than births since 2021 (2023: 41,300 births, 57,200 deaths)","1 in 4 people is 65 or older (2025); median age 46.2","17% of people born here now live abroad (1.2 million, 2024)"]},{"rank":2,"iso3":"UKR","name":"Ukraine","region":"Europe & Central Asia","score":87,"tier":"Critical","components":{"fertility":{"value":0.855,"points":29.9,"weight":35},"naturalChange":{"value":1,"points":15,"weight":15},"aging":{"value":0.601,"points":6,"weight":10},"projectedDecline":{"value":0.866,"points":26,"weight":30},"migration":{"value":1,"points":10,"weight":10}},"inputs":{"tfr":0.988,"naturalChangeRate":-8.1,"share65":19,"medianAge":42,"change2050Pct":-15.2,"change2100Pct":-59.7,"naturalChange":-283189,"netMigration":-299961,"populationChangePerThousand":-15.5,"migrationOffsetPct":-106},"factors":["Fertility 0.99 births per woman (2024), about half of the 2.1 replacement level","UN projects a 60% fall by 2100 (37.7 million in 2023 → 15.2 million); peaked in 1993","More deaths than births since 1991 (2023: 212,000 births, 495,000 deaths)","More people leave than arrive (net outflow 300,000 in 2023), deepening the decline","1 in 5 people is 65 or older (2025); median age 42.0","26% of people born here now live abroad (9.8 million, 2024)"]},{"rank":3,"iso3":"TWN","name":"Taiwan","region":"East Asia & Pacific","score":85,"tier":"Critical","components":{"fertility":{"value":0.946,"points":33.1,"weight":35},"naturalChange":{"value":0.675,"points":10.1,"weight":15},"aging":{"value":0.616,"points":6.2,"weight":10},"projectedDecline":{"value":0.856,"points":25.7,"weight":30},"migration":{"value":1,"points":10,"weight":10}},"inputs":{"tfr":0.87,"naturalChangeRate":-3.1,"share65":18.3,"medianAge":43.5,"change2050Pct":-16.7,"change2100Pct":-57,"naturalChange":-72933,"netMigration":-32777,"populationChangePerThousand":-4.5,"migrationOffsetPct":-45},"factors":["Fertility 0.87 births per woman (2023), about two-fifths of the 2.1 replacement level","UN projects a 57% fall by 2100 (23.3 million in 2023 → 10 million); peaked in 2019","More deaths than births since 2019 (2023: 132,000 births, 205,000 deaths)","More people leave than arrive (net outflow 32,800 in 2023), deepening the decline","1 in 5 people is 65 or older (2023); median age 43.5"]},{"rank":4,"iso3":"PRI","name":"Puerto Rico","region":"Latin America & Caribbean","score":81,"tier":"Critical","components":{"fertility":{"value":0.908,"points":31.8,"weight":35},"naturalChange":{"value":0.8,"points":12,"weight":15},"aging":{"value":0.804,"points":8,"weight":10},"projectedDecline":{"value":0.971,"points":29.1,"weight":30},"migration":{"value":0,"points":0,"weight":10}},"inputs":{"tfr":0.92,"naturalChangeRate":-4.6,"share65":25.3,"medianAge":45.3,"change2050Pct":-22.8,"change2100Pct":-69.3,"naturalChange":-15814,"netMigration":19833,"populationChangePerThousand":1.2,"migrationOffsetPct":125},"factors":["Fertility 0.92 births per woman (2024), about two-fifths of the 2.1 replacement level","UN projects a 69% fall by 2100 (3.2 million in 2023 → 996,000); peaked in 2001","More deaths than births since 2014 (2023: 18,900 births, 34,700 deaths)","1 in 4 people is 65 or older (2025); median age 45.3","Immigration more than offsets the natural decline (2023: net +19,800)","60% of people born here now live abroad (1.9 million, 2024)"]},{"rank":5,"iso3":"BLR","name":"Belarus","region":"Europe & Central Asia","score":78,"tier":"Critical","components":{"fertility":{"value":0.679,"points":23.8,"weight":35},"naturalChange":{"value":0.925,"points":13.9,"weight":15},"aging":{"value":0.556,"points":5.6,"weight":10},"projectedDecline":{"value":0.824,"points":24.7,"weight":30},"migration":{"value":1,"points":10,"weight":10}},"inputs":{"tfr":1.217,"naturalChangeRate":-6.1,"share65":18.3,"medianAge":40.5,"change2050Pct":-18.2,"change2100Pct":-52.3,"naturalChange":-56536,"netMigration":-3034,"populationChangePerThousand":-6.5,"migrationOffsetPct":-5},"factors":["UN projects a 52% fall by 2100 (9.1 million in 2023 → 4.4 million); peaked in 1993","Fertility 1.22 births per woman (2024), about three-fifths of the 2.1 replacement level","More deaths than births since 1993 (2023: 65,100 births, 122,000 deaths)","More people leave than arrive (net outflow 3,030 in 2023), deepening the decline","1 in 5 people is 65 or older (2025); median age 40.5"]},{"rank":6,"iso3":"KOR","name":"South Korea","region":"East Asia & Pacific","score":77,"tier":"Critical","components":{"fertility":{"value":1,"points":35,"weight":35},"naturalChange":{"value":0.608,"points":9.1,"weight":15},"aging":{"value":0.679,"points":6.8,"weight":10},"projectedDecline":{"value":0.813,"points":24.4,"weight":30},"migration":{"value":0.195,"points":2,"weight":10}},"inputs":{"tfr":0.748,"naturalChangeRate":-2.3,"share65":20.3,"medianAge":44.5,"change2050Pct":-12.8,"change2100Pct":-57.8,"naturalChange":-109109,"netMigration":87800,"populationChangePerThousand":-0.4,"migrationOffsetPct":80},"factors":["Fertility 0.75 births per woman (2024), about a third of the 2.1 replacement level","UN projects a 58% fall by 2100 (51.7 million in 2023 → 21.8 million); peaked in 2020","More deaths than births since 2019 (2023: 236,000 births, 346,000 deaths)","1 in 5 people is 65 or older (2025); median age 44.5","Immigration offsets only 80% of the natural decline (2023: net +87,800)"]},{"rank":7,"iso3":"JPN","name":"Japan","region":"East Asia & Pacific","score":77,"tier":"Critical","components":{"fertility":{"value":0.731,"points":25.6,"weight":35},"naturalChange":{"value":1,"points":15,"wei